{
  "generated_at": "2026-10-28T17:23:23.930707+00:00",
  "health": [
    {
      "error": null,
      "item_count": 14,
      "ok": true,
      "source": "Hacker News"
    }
  ],
  "observations": [
    {
      "categories": [
        "benchmark"
      ],
      "discovered_at": "2026-10-28T17:23:23.930707+00:00",
      "event_kind": "discussed",
      "id": "hacker-news:50273340",
      "metrics": {
        "comments": 0.0,
        "points": 2.0,
        "submissions": 1.0
      },
      "primary_artifact_url": "https://www.interconnects.ai/p/artificial-analysis-v5-and-the-benchmarkers",
      "published_at": "2026-10-28T13:38:04+00:00",
      "rationale": [
        "Attention signal only; not scientific-quality evidence",
        "Public Hacker News story matched query: AI benchmark"
      ],
      "source": "Hacker News",
      "source_id": "50273340",
      "summary": "Public Hacker News discussion linking to www.interconnects.ai.",
      "title": "Artificial Analysis v5 and the benchmarker's dilemma",
      "url": "https://news.ycombinator.com/item?id=50273340"
    },
    {
      "categories": [
        "benchmark"
      ],
      "discovered_at": "2026-10-28T17:23:23.930707+00:00",
      "event_kind": "discussed",
      "id": "hacker-news:50262573",
      "metrics": {
        "comments": 0.0,
        "points": 1.0,
        "submissions": 1.0
      },
      "primary_artifact_url": "https://github.com/psinglap/websearch-api-eval",
      "published_at": "2026-10-27T17:25:18+00:00",
      "rationale": [
        "Attention signal only; not scientific-quality evidence",
        "Public Hacker News story matched query: AI benchmark"
      ],
      "source": "Hacker News",
      "source_id": "50262573",
      "summary": "Public Hacker News discussion linking to github.com.",
      "title": "I benchmarked 4 web search APIs for AI agents on 30 live queries",
      "url": "https://news.ycombinator.com/item?id=50262573"
    },
    {
      "categories": [
        "benchmark"
      ],
      "discovered_at": "2026-10-28T17:23:23.930707+00:00",
      "event_kind": "discussed",
      "id": "hacker-news:50262396",
      "metrics": {
        "comments": 1.0,
        "points": 2.0,
        "submissions": 1.0
      },
      "primary_artifact_url": "https://cocolabs.ai/blog/introducing-vybbench",
      "published_at": "2026-10-27T17:14:19+00:00",
      "rationale": [
        "Attention signal only; not scientific-quality evidence",
        "Public Hacker News story matched query: AI benchmark"
      ],
      "source": "Hacker News",
      "source_id": "50262396",
      "summary": "Public Hacker News discussion linking to cocolabs.ai.",
      "title": "Almost isn't good enough: Introducing VybBench, our Design Fidelity Benchmark",
      "url": "https://news.ycombinator.com/item?id=50262396"
    },
    {
      "categories": [
        "benchmark"
      ],
      "discovered_at": "2026-10-28T17:23:23.930707+00:00",
      "event_kind": "discussed",
      "id": "hacker-news:50259887",
      "metrics": {
        "comments": 2.0,
        "points": 1.0,
        "submissions": 1.0
      },
      "primary_artifact_url": "https://aexol.ai/benchmarks/localllama/",
      "published_at": "2026-10-27T14:26:02+00:00",
      "rationale": [
        "Attention signal only; not scientific-quality evidence",
        "Public Hacker News story matched query: AI benchmark"
      ],
      "source": "Hacker News",
      "source_id": "50259887",
      "summary": "Public Hacker News discussion linking to aexol.ai.",
      "title": "Show HN: I made /localllama Reddit benchmark using AI ofc",
      "url": "https://news.ycombinator.com/item?id=50259887"
    },
    {
      "categories": [
        "benchmark"
      ],
      "discovered_at": "2026-10-28T17:23:23.930707+00:00",
      "event_kind": "discussed",
      "id": "hacker-news:50258722",
      "metrics": {
        "comments": 4.0,
        "points": 6.0,
        "submissions": 1.0
      },
      "primary_artifact_url": "https://www.heal.dev/benchmark",
      "published_at": "2026-10-27T13:14:03+00:00",
      "rationale": [
        "Attention signal only; not scientific-quality evidence",
        "Public Hacker News story matched query: AI benchmark"
      ],
      "source": "Hacker News",
      "source_id": "50258722",
      "summary": "Public Hacker News discussion linking to www.heal.dev.",
      "title": "Static reasoning can't prove runtime behavior: benchmark of AI PR reviewers",
      "url": "https://news.ycombinator.com/item?id=50258722"
    },
    {
      "categories": [
        "benchmark"
      ],
      "discovered_at": "2026-10-28T17:23:23.930707+00:00",
      "event_kind": "discussed",
      "id": "hacker-news:50251285",
      "metrics": {
        "comments": 0.0,
        "points": 2.0,
        "submissions": 1.0
      },
      "primary_artifact_url": "https://github.com/Koppar-AI/autorouter-bench",
      "published_at": "2026-10-26T21:30:18+00:00",
      "rationale": [
        "Attention signal only; not scientific-quality evidence",
        "Public Hacker News story matched query: AI benchmark"
      ],
      "source": "Hacker News",
      "source_id": "50251285",
      "summary": "Public Hacker News discussion linking to github.com.",
      "title": "Show HN: Autorouter Benchmark on Various PCBs",
      "url": "https://news.ycombinator.com/item?id=50251285"
    },
    {
      "categories": [
        "benchmark"
      ],
      "discovered_at": "2026-10-28T17:23:23.930707+00:00",
      "event_kind": "discussed",
      "id": "hacker-news:50242444",
      "metrics": {
        "comments": 0.0,
        "points": 2.0,
        "submissions": 1.0
      },
      "primary_artifact_url": "https://epoch.ai/benchmarks",
      "published_at": "2026-10-26T12:22:06+00:00",
      "rationale": [
        "Attention signal only; not scientific-quality evidence",
        "Public Hacker News story matched query: AI benchmark"
      ],
      "source": "Hacker News",
      "source_id": "50242444",
      "summary": "Public Hacker News discussion linking to epoch.ai.",
      "title": "Proper Benchmarks",
      "url": "https://news.ycombinator.com/item?id=50242444"
    },
    {
      "categories": [
        "benchmark"
      ],
      "discovered_at": "2026-10-28T17:23:23.930707+00:00",
      "event_kind": "discussed",
      "id": "hacker-news:50239697",
      "metrics": {
        "comments": 0.0,
        "points": 2.0,
        "submissions": 1.0
      },
      "primary_artifact_url": "https://frontierlog.ai/",
      "published_at": "2026-10-26T06:02:24+00:00",
      "rationale": [
        "Attention signal only; not scientific-quality evidence",
        "Public Hacker News story matched query: AI benchmark"
      ],
      "source": "Hacker News",
      "source_id": "50239697",
      "summary": "Public Hacker News discussion linking to frontierlog.ai.",
      "title": "Show HN: Frontier Log – Database of AI events, models and benchmarks",
      "url": "https://news.ycombinator.com/item?id=50239697"
    },
    {
      "categories": [
        "benchmark"
      ],
      "discovered_at": "2026-10-28T17:23:23.930707+00:00",
      "event_kind": "discussed",
      "id": "hacker-news:50233570",
      "metrics": {
        "comments": 0.0,
        "points": 2.0,
        "submissions": 1.0
      },
      "primary_artifact_url": "https://keln.ai/blog/ai-gateway-benchmark-deepseek-v4-1-flash",
      "published_at": "2026-10-25T16:53:40+00:00",
      "rationale": [
        "Attention signal only; not scientific-quality evidence",
        "Public Hacker News story matched query: AI benchmark"
      ],
      "source": "Hacker News",
      "source_id": "50233570",
      "summary": "Public Hacker News discussion linking to keln.ai.",
      "title": "AI Gateway Benchmark: OpenRouter, Vercel, Ramp, Keln",
      "url": "https://news.ycombinator.com/item?id=50233570"
    },
    {
      "categories": [
        "benchmark"
      ],
      "discovered_at": "2026-10-28T17:23:23.930707+00:00",
      "event_kind": "discussed",
      "id": "hacker-news:50219762",
      "metrics": {
        "comments": 1.0,
        "points": 3.0,
        "submissions": 1.0
      },
      "published_at": "2026-10-24T10:09:27+00:00",
      "rationale": [
        "Attention signal only; not scientific-quality evidence",
        "Public Hacker News story matched query: LLM evaluation"
      ],
      "source": "Hacker News",
      "source_id": "50219762",
      "summary": "Public discussion submitted to Hacker News.",
      "title": "Show HN: Benchmarks of continual learning model trained for a month on a laptop",
      "url": "https://news.ycombinator.com/item?id=50219762"
    },
    {
      "categories": [
        "benchmark"
      ],
      "discovered_at": "2026-10-28T17:23:23.930707+00:00",
      "event_kind": "discussed",
      "id": "hacker-news:50214606",
      "metrics": {
        "comments": 1.0,
        "points": 1.0,
        "submissions": 1.0
      },
      "primary_artifact_url": "https://www.endorlabs.com/research/ai-code-security-benchmark",
      "published_at": "2026-10-23T20:08:49+00:00",
      "rationale": [
        "Attention signal only; not scientific-quality evidence",
        "Public Hacker News story matched query: AI benchmark"
      ],
      "source": "Hacker News",
      "source_id": "50214606",
      "summary": "Public Hacker News discussion linking to www.endorlabs.com.",
      "title": "AI Coding Agent Security Benchmark",
      "url": "https://news.ycombinator.com/item?id=50214606"
    },
    {
      "categories": [
        "benchmark"
      ],
      "discovered_at": "2026-10-28T17:23:23.930707+00:00",
      "event_kind": "discussed",
      "id": "hacker-news:50207358",
      "metrics": {
        "comments": 0.0,
        "points": 1.0,
        "submissions": 1.0
      },
      "primary_artifact_url": "https://github.com/deepsense-ai/eda-benchmark",
      "published_at": "2026-10-23T11:35:39+00:00",
      "rationale": [